id,name,level,summary,Industries_Served
digiteon+consulting,Digiteon Consulting,Bronze,Digiteon works exclusively with Agencies and Enterprises as their extended team to maximize efficiency and productivity. Our clients are primarily companies providing Magento and .NET consulting services to their end-customers.,"[""B2B High Tech"", ""Consumer Packaged Goods"", ""Education"", ""Manufacturing & Distribution"", ""Other (HR / IT / Legal / etc.)""]"
ironplane,IronPlane,Bronze,"IronPlane's team of highly skilled, certified developers and innovative eCommerce solution specialists have a deep knowledge of both Magento Open Source and Adobe Commerce and a passion for elevating our clients' success online.","[""Retail""]"
maqe,MAQE,Bronze,MAQE is an experience commerce company. We design experiences for your customers with one guiding focus; helping you sell more.,"[""Automotive"", ""B2B High Tech"", ""Consumer Packaged Goods"", ""Education"", ""Financial Services / Insurance"", ""Manufacturing & Distribution"", ""Media, Entertainment & Telecom"", ""Non-Profit"", ""Other (HR / IT / Legal / etc.)"", ""Retail"", ""Travel & Hospitality""]"
macopedia,Macopedia,Bronze,Technology partner from e-commerce to warehousing.,"[""B2B High Tech"", ""Consumer Packaged Goods"", ""Education"", ""Government / Public Sector"", ""Manufacturing & Distribution"", ""Media, Entertainment & Telecom"", ""Retail"", ""Travel & Hospitality""]"
nulogic,NULOGIC,Bronze,NULogic (Formally Known as NU Technology Inc) is one of the leading digital transformation companies that combines software expertise and industry intelligence. NULOGIC is an Adobe Commerce (Magento) Bronze Partner.,"[""B2B High Tech"", ""Consumer Packaged Goods"", ""Manufacturing & Distribution"", ""Media, Entertainment & Telecom"", ""Retail"", ""Travel & Hospitality""]"
trellis,Trellis,Bronze,Full Service eCommerce Consultancy,"[""Automotive"", ""B2B High Tech"", ""Consumer Packaged Goods"", ""Education"", ""Financial Services / Insurance"", ""Manufacturing & Distribution"", ""Media, Entertainment & Telecom"", ""Non-Profit"", ""Other (HR / IT / Legal / etc.)"", ""Retail"", ""Travel & Hospitality""]"
sirius+computer+solutions+inc,SIRIUS COMPUTER SOLUTIONS INC,Gold,"Sirius offers integrated, multivendor technology solutions that meet the requirements of the full range of organizations, from small businesses with fewer than 100 employees to large enterprises with thousands of employees and hundreds of locations.","[""Automotive"", ""B2B High Tech"", ""Consumer Packaged Goods"", ""Education"", ""Financial Services / Insurance"", ""Government / Public Sector"", ""Healthcare & Life Sciences"", ""Manufacturing & Distribution"", ""Media, Entertainment & Telecom"", ""Other (HR / IT / Legal / etc.)"", ""Retail"", ""Travel & Hospitality""]"
alva+commerce+s.r.o.,Alva Commerce s.r.o.,Bronze,Trusted technical solution partner for e-commerce,"[""Automotive"", ""B2B High Tech"", ""Financial Services / Insurance"", ""Government / Public Sector"", ""Manufacturing & Distribution"", ""Retail"", ""Travel & Hospitality""]"
jola,Jola,Bronze,Your all inclusive eCommerce and 3D technology partner.,"[""B2B High Tech"", ""Manufacturing & Distribution"", ""Retail""]"
onetree,Onetree,Bronze,Onetree is a nearshore design and development company. Our differentiator is our discovery phase that quickly and thoroughly identifies the project requirements so that everyone is clear and in agreement of what needs to be done.,"[""Automotive"", ""B2B High Tech"", ""Education"", ""Financial Services / Insurance"", ""Government / Public Sector"", ""Media, Entertainment & Telecom"", ""Retail"", ""Travel & Hospitality""]"
tech+mahindra,Tech Mahindra,Platinum,"Tech Mahindra is a USD 6.5+ billion organization with 148K+ professionals across 90 countries helping 1250+ global customers, including Fortune 500 companies.","[""Automotive"", ""B2B High Tech"", ""Consumer Packaged Goods"", ""Education"", ""Financial Services / Insurance"", ""Government / Public Sector"", ""Manufacturing & Distribution"", ""Media, Entertainment & Telecom"", ""Non-Profit"", ""Other (HR / IT / Legal / etc.)"", ""Retail"", ""Travel & Hospitality""]"
vass,VASS,Gold,"VASS is an IT consulting founded in 1999, highly specialized in new technologies and integration of products and services with a deep knowledge and mastery of digital user experience including AEM/CQ.","[""Automotive"", ""B2B High Tech"", ""Consumer Packaged Goods"", ""Education"", ""Financial Services / Insurance"", ""Government / Public Sector"", ""Manufacturing & Distribution"", ""Media, Entertainment & Telecom"", ""Other (HR / IT / Legal / etc.)"", ""Retail"", ""Travel & Hospitality""]"
bajaj+finserv+direct+limited,Bajaj Finserv Direct Limited,Bronze,"Bringing digital transformation to  B2B & B2C customers using Adobe Cloud (Adobe Experience Cloud, Adobe Commerce Cloud, Analytics, Target etc.)","[""Automotive"", ""B2B High Tech"", ""Consumer Packaged Goods"", ""Education"", ""Financial Services / Insurance"", ""Government / Public Sector"", ""Manufacturing & Distribution"", ""Media, Entertainment & Telecom"", ""Other (HR / IT / Legal / etc.)"", ""Retail"", ""Travel & Hospitality""]"
bizmia+llc,Bizmia LLC,Bronze,"Enabling Success Through Magento Excellence: Innovating, Evolving, and Thriving in Digital Commerce","[""Automotive"", ""B2B High Tech"", ""Consumer Packaged Goods"", ""Manufacturing & Distribution"", ""Media, Entertainment & Telecom"", ""Retail"", ""Travel & Hospitality""]"
blue+stingray,Blue Stingray,Bronze,"Blue Stingray is the go-to source of cloud-based software solutions for enterprise businesses. Our innovations enhance productivity, simplify workflow, and deliver the precise services your operation needs to excel.","[""B2B High Tech"", ""Financial Services / Insurance"", ""Manufacturing & Distribution"", ""Retail""]"
cbi+digital,CBI Digital,Bronze,CB/I Digital is a digital marketing and platform development firm that specializes in growing traffic and revenue for DTC Ecommerce brands as well as traditional enterprises.,"[""B2B High Tech"", ""Manufacturing & Distribution"", ""Retail"", ""Travel & Hospitality""]"
engineering+ingegneria+informatica+s.p.a,Engineering Ingegneria Informatica S.p.A,Bronze,Engineering the digital trasformation company,"[""Automotive"", ""B2B High Tech"", ""Government / Public Sector"", ""Media, Entertainment & Telecom"", ""Other (HR / IT / Legal / etc.)""]"
envision+ecommerce+inc.,Envision Ecommerce Inc.,Bronze,"A capable, seasoned Commerce partner with an established reputation as a go-to agency for project rescues and complex site builds. We are accessible, scalable and reliable technology provider. As a result, we help hundreds of merchants realize their ROI.","[""Automotive"", ""B2B High Tech"", ""Education"", ""Manufacturing & Distribution"", ""Media, Entertainment & Telecom"", ""Non-Profit"", ""Retail"", ""Travel & Hospitality""]"
innover+inc.,Innover INC.,Bronze,"Innover INC. is a fast growing applied digital transformation firm headquartered in Atlanta. With our experience with Fortune 50 companies and focus on core Digital and Data & Analytics solutions, we drive positive business impact for our clients","[""Automotive"", ""B2B High Tech"", ""Consumer Packaged Goods"", ""Education"", ""Financial Services / Insurance"", ""Government / Public Sector"", ""Healthcare & Life Sciences"", ""Manufacturing & Distribution"", ""Media, Entertainment & Telecom""]"
kinex+media+inc.,Kinex Media Inc.,Bronze,"Kinex Media is an leading eCommerce service provider offering a wide range of services including strategy, development, optimization, system integration and marketing.","[""Automotive"", ""B2B High Tech"", ""Consumer Packaged Goods"", ""Financial Services / Insurance"", ""Manufacturing & Distribution"", ""Retail"", ""Travel & Hospitality""]"
nsight%2C+inc.,"Nsight, Inc.",Bronze,Accelerating Digital Transformation and Enriching Customer Experience,"[""Automotive"", ""B2B High Tech"", ""Consumer Packaged Goods"", ""Education"", ""Manufacturing & Distribution"", ""Media, Entertainment & Telecom"", ""Retail""]"
proproducts+web+development,ProProducts Web Development,Bronze,"PPWD is a New England based Adobe/Magento partner that specializes in Adobe/Magento Commerce Cloud, B2B, B2C, and Custom Integrations. 100% US Resources.","[""B2B High Tech"", ""Healthcare & Life Sciences"", ""Manufacturing & Distribution"", ""Retail""]"
royal+cyber+inc,Royal Cyber Inc,Bronze,IT Solutions and Service Provider,"[""Automotive"", ""B2B High Tech"", ""Education"", ""Financial Services / Insurance"", ""Government / Public Sector"", ""Healthcare & Life Sciences"", ""Media, Entertainment & Telecom"", ""Other (HR / IT / Legal / etc.)"", ""Retail"", ""Travel & Hospitality""]"
swarming+technology,Swarming Technology,Bronze,"An e-commerce firm that specializes in Magento and making high performing e-commerce sites manageable, so you can focus on growing your business.","[""Automotive"", ""B2B High Tech"", ""Consumer Packaged Goods"", ""Education"", ""Healthcare & Life Sciences"", ""Manufacturing & Distribution"", ""Media, Entertainment & Telecom"", ""Retail""]"
tychons+usa+llc,Tychons USA LLC,Bronze,Digital Commerce and Transformation Company,"[""Automotive"", ""B2B High Tech"", ""Consumer Packaged Goods"", ""Financial Services / Insurance"", ""Manufacturing & Distribution"", ""Media, Entertainment & Telecom"", ""Retail"", ""Travel & Hospitality""]"
unthinkable+solutions+llp,Unthinkable Solutions LLP,Bronze,Need help with your digital commerce platform? Get to know how technology can be leveraged to turn your idea into a reality. Schedule a call with our expert.,"[""Automotive"", ""B2B High Tech"", ""Education"", ""Financial Services / Insurance"", ""Government / Public Sector"", ""Media, Entertainment & Telecom"", ""Other (HR / IT / Legal / etc.)"", ""Retail"", ""Travel & Hospitality""]"
webqem+pty+ltd,webqem Pty Ltd,Bronze,"webqem provides a one-stop online solution - delivering web site design and development, ecommerce, marketing, and elearning services.","[""Automotive"", ""B2B High Tech"", ""Consumer Packaged Goods"", ""Education"", ""Financial Services / Insurance"", ""Government / Public Sector"", ""Healthcare & Life Sciences"", ""Manufacturing & Distribution"", ""Media, Entertainment & Telecom"", ""Non-Profit"", ""Other (HR / IT / Legal / etc.)"", ""Retail"", ""Travel & Hospitality""]"
avanade,Avanade,Platinum,Power of 3 with Avanade + Adobe + Microsoft,"[""Automotive"", ""B2B High Tech"", ""Consumer Packaged Goods"", ""Education"", ""Financial Services / Insurance"", ""Manufacturing & Distribution"", ""Media, Entertainment & Telecom"", ""Non-Profit"", ""Other (HR / IT / Legal / etc.)"", ""Retail"", ""Travel & Hospitality""]"
emakina+group,Emakina Group,Platinum,"Emakina Group, an EPAM company, is a top European independent group of agencies in digital and communications focused on helping clients build better digital businesses","[""Automotive"", ""B2B High Tech"", ""Consumer Packaged Goods"", ""Education"", ""Financial Services / Insurance"", ""Government / Public Sector"", ""Healthcare & Life Sciences"", ""Manufacturing & Distribution"", ""Media, Entertainment & Telecom"", ""Other (HR / IT / Legal / etc.)"", ""Retail"", ""Travel & Hospitality""]"
interpublic+group,Interpublic Group,Platinum,Interpublic is one of the world's leading organizations of advertising agencies and marketing services companies.,"[""Education"", ""Financial Services / Insurance"", ""Government / Public Sector"", ""Healthcare & Life Sciences"", ""Manufacturing & Distribution"", ""Media, Entertainment & Telecom"", ""Other (HR / IT / Legal / etc.)"", ""Retail""]"
virtusa+corporation,Virtusa Corporation,Platinum,"Virtusa Digital blends unique perspectives and proven expertise from across consulting, design and engineering disciplines. We challenge convention, and one another, to create compelling experiences that delight users and transform business.","[""B2B High Tech"", ""Education"", ""Financial Services / Insurance"", ""Government / Public Sector"", ""Healthcare & Life Sciences"", ""Manufacturing & Distribution"", ""Media, Entertainment & Telecom"", ""Retail"", ""Travel & Hospitality""]"
bdo+digital,BDO Digital,Gold,"At BDO Digital, we help B2B marketing leaders drive growth through high-performance demand generation and make the most of their investment in Marketo Engage and Bizible.","[""B2B High Tech"", ""Financial Services / Insurance"", ""Healthcare & Life Sciences"", ""Manufacturing & Distribution"", ""Media, Entertainment & Telecom"", ""Other (HR / IT / Legal / etc.)"", ""Retail""]"
ntt+data,NTT DATA,Gold,"NTT DATA – a part of NTT Group – is a trusted global innovator of IT and business services headquartered in Tokyo. We help clients transform through consulting, industry solutions, business process services, IT modernization and managed services.","[""Automotive"", ""B2B High Tech"", ""Consumer Packaged Goods"", ""Education"", ""Financial Services / Insurance"", ""Government / Public Sector"", ""Manufacturing & Distribution"", ""Media, Entertainment & Telecom"", ""Other (HR / IT / Legal / etc.)"", ""Retail"", ""Travel & Hospitality""]"
moonraft+innovation+labs,Moonraft Innovation Labs,Silver,"Moonraft, a UST Company, specializes in design-driven Digital Innovation and Customer Experience Management Solutions. We bring together design, art & technology to deliver personalized & consistent customer experiences that drive business outcomes","[""Automotive"", ""B2B High Tech"", ""Consumer Packaged Goods"", ""Education"", ""Financial Services / Insurance"", ""Healthcare & Life Sciences"", ""Manufacturing & Distribution"", ""Media, Entertainment & Telecom"", ""Non-Profit"", ""Other (HR / IT / Legal / etc.)"", ""Retail"", ""Travel & Hospitality""]"
aiti+smart%2C+s.r.o.,"AITI Smart, s.r.o.",Bronze,Introducing AITI.cz: Your Magento Ecommerce Solutions Partner,"[""Automotive"", ""B2B High Tech"", ""Consumer Packaged Goods"", ""Education"", ""Financial Services / Insurance"", ""Government / Public Sector"", ""Manufacturing & Distribution"", ""Media, Entertainment & Telecom"", ""Non-Profit"", ""Other (HR / IT / Legal / etc.)"", ""Retail"", ""Travel & Hospitality""]"
astral+web+taiwan,Astral Web Taiwan,Bronze,We’re eCommerce Specialists! Astral Web Transforms Businesses Online.,"[""Automotive"", ""B2B High Tech"", ""Consumer Packaged Goods"", ""Education"", ""Financial Services / Insurance"", ""Government / Public Sector"", ""Manufacturing & Distribution"", ""Media, Entertainment & Telecom"", ""Non-Profit"", ""Other (HR / IT / Legal / etc.)"", ""Retail"", ""Travel & Hospitality""]"
axamit,Axamit,Bronze,Expert Consultants Fusing Business Vision with Technology Solutions,"[""Automotive"", ""B2B High Tech"", ""Consumer Packaged Goods"", ""Education"", ""Financial Services / Insurance"", ""Manufacturing & Distribution"", ""Media, Entertainment & Telecom"", ""Non-Profit"", ""Other (HR / IT / Legal / etc.)"", ""Retail"", ""Travel & Hospitality""]"
birlasoft+limited,BIRLASOFT LIMITED,Bronze,Birlasoft is a global information technology services and consulting company that provides a wide range of IT solutions and services to businesses across various industries.,"[""B2B High Tech"", ""Financial Services / Insurance"", ""Manufacturing & Distribution"", ""Media, Entertainment & Telecom""]"
cybersolutions+usa+llc,CyberSolutions USA LLC,Bronze,"CyberSolutions is a global leader in Magento development. Not only are we developers, but we consider ourselves a partner and extension of the companies we work for. Work with us and leverage our expertise of over 16 years in E-commerce.","[""Automotive"", ""B2B High Tech"", ""Consumer Packaged Goods"", ""Government / Public Sector"", ""Manufacturing & Distribution"", ""Retail""]"
divante+s.a.,Divante S.A.,Bronze,"Empowering eCommerce. Divante is a global e-commerce technology company, helping their customers grow by implementing the best solutions that meet their needs.","[""Automotive"", ""B2B High Tech"", ""Consumer Packaged Goods"", ""Education"", ""Financial Services / Insurance"", ""Government / Public Sector"", ""Healthcare & Life Sciences"", ""Manufacturing & Distribution"", ""Media, Entertainment & Telecom"", ""Other (HR / IT / Legal / etc.)"", ""Retail"", ""Travel & Hospitality""]"
graybox,GRAYBOX,Bronze,"GRAYBOX is a digital consulting agency that helps solve challenges, reach audiences and optimizes operations with elegance, utility & expertise.","[""Automotive"", ""B2B High Tech"", ""Consumer Packaged Goods"", ""Education"", ""Manufacturing & Distribution"", ""Non-Profit"", ""Retail"", ""Travel & Hospitality""]"
globant,Globant,Bronze,"Globant (NYSE: GLOB) is a digitally native company that helps organizations reinvent themselves to create a way forward and unleash their potential. It is the place where innovation, design and engineering meet scale.","[""Automotive"", ""B2B High Tech"", ""Consumer Packaged Goods"", ""Education"", ""Financial Services / Insurance"", ""Media, Entertainment & Telecom"", ""Retail"", ""Travel & Hospitality""]"
humcommerce,HumCommerce,Bronze,eCommerce Solutions for B2B & B2C brands,"[""B2B High Tech"", ""Consumer Packaged Goods"", ""Manufacturing & Distribution"", ""Retail""]"
it+consultis,IT Consultis,Bronze,"IT Consultis (ITC) is an award-winning Digital Transformation Consultancy in China & Asia, empowering Fortune 500 companies and C-Levels with the right strategy & execution playbook.","[""Automotive"", ""B2B High Tech"", ""Consumer Packaged Goods"", ""Education"", ""Financial Services / Insurance"", ""Government / Public Sector"", ""Manufacturing & Distribution"", ""Media, Entertainment & Telecom"", ""Non-Profit"", ""Other (HR / IT / Legal / etc.)"", ""Retail"", ""Travel & Hospitality""]"
icon+commerce,Icon Commerce,Bronze,"We are an Ecommerce Agency focused on the Future. We are Amazon, Shopify and Magento Experts. We Enable Brand Commerce. We offer complete Magento 2 services, support and a proven process that drives results.","[""B2B High Tech"", ""Consumer Packaged Goods"", ""Financial Services / Insurance"", ""Manufacturing & Distribution""]"
interactone+inc,InteractOne Inc,Bronze,"InteractOne specializes in the mid-market (merchants generating online sales of $4MM-$100MM). Since 1998, we have been helping clients exceed their eCommerce expectations. We will build your eCommerce site, help maintain it, and help drive sales.","[""Automotive"", ""Consumer Packaged Goods"", ""Manufacturing & Distribution"", ""Retail"", ""Travel & Hospitality""]"
jakala+s.p.a.,JAKALA S.p.A.,Bronze,"JAKALA is the first Italian Martech Company offering its customers strategic, analytics, digital and technological support by leveraging on unique assets and know-how, as well as adopting innovative models aimed at achieving measurable results.","[""Automotive"", ""Consumer Packaged Goods"", ""Financial Services / Insurance"", ""Media, Entertainment & Telecom"", ""Retail"", ""Travel & Hospitality""]"
leanswift+solutions%2C+inc.,"LeanSwift Solutions, Inc.",Bronze,"We have been delivering integration solutions for 20+ years with a focus on INFOR ERP, eCommerce, and mobile. Our Magento implementation experience covers B2B, B2C, and hybrid customers of all sizes.","[""Automotive"", ""B2B High Tech"", ""Government / Public Sector"", ""Manufacturing & Distribution"", ""Retail""]"
leeto+digital+agency,Leeto Digital Agency,Bronze,Leeto Digital Agency - Custom Magento Developments,"[""B2B High Tech"", ""Other (HR / IT / Legal / etc.)"", ""Retail""]"
lingaro+digital+commerce+sp.+z+o.o.,Lingaro Digital Commerce sp. z o.o.,Bronze,"We are Lingaro Group’s digital commerce practice, helping businesses redefine their digital customer experience and elevate their e-commerce capabilities.","[""Automotive"", ""B2B High Tech"", ""Consumer Packaged Goods"", ""Manufacturing & Distribution"", ""Retail""]"
net+solutions,Net Solutions,Bronze,"We design, build and grow digital products and platforms for global brands.","[""Automotive"", ""B2B High Tech"", ""Consumer Packaged Goods"", ""Education"", ""Financial Services / Insurance"", ""Government / Public Sector"", ""Healthcare & Life Sciences"", ""Manufacturing & Distribution"", ""Media, Entertainment & Telecom"", ""Other (HR / IT / Legal / etc.)"", ""Retail"", ""Travel & Hospitality""]"
objectwave,ObjectWave,Bronze,ObjectWave is a full-service digital solution provider focused on our customer’s customer. An Adobe partner since 2013 with experience implementing the full stack of Adobe solutions. Also a Magento Partner with over 60 successful ecommerce implementations,"[""Automotive"", ""B2B High Tech"", ""Consumer Packaged Goods"", ""Financial Services / Insurance"", ""Healthcare & Life Sciences"", ""Manufacturing & Distribution"", ""Media, Entertainment & Telecom"", ""Retail"", ""Travel & Hospitality""]"
retail+reinvented,Retail Reinvented,Bronze,"eCommerce Management Agency - We build, grow & manage eCommerce businesses for global brands.","[""B2B High Tech"", ""Consumer Packaged Goods"", ""Manufacturing & Distribution"", ""Retail""]"
skavatar,SKAVATAR,Bronze,"Skavatar offers web development, technology support, strategy & consulting, design services and more.","[""B2B High Tech"", ""Education"", ""Media, Entertainment & Telecom"", ""Retail"", ""Travel & Hospitality""]"
smartosc+corporation,SmartOSC Corporation,Bronze,We Build Data-Driven Ecommerce Stores that Convert,"[""Automotive"", ""B2B High Tech"", ""Consumer Packaged Goods"", ""Financial Services / Insurance"", ""Government / Public Sector"", ""Healthcare & Life Sciences"", ""Manufacturing & Distribution"", ""Media, Entertainment & Telecom"", ""Retail"", ""Travel & Hospitality""]"
technopath,Technopath,Bronze,We mold technology for your success.,"[""Automotive"", ""B2B High Tech"", ""Consumer Packaged Goods"", ""Education"", ""Government / Public Sector"", ""Manufacturing & Distribution"", ""Retail""]"
zensar+technologies,Zensar Technologies,Bronze,Think Velocity with Zensar,"[""Automotive"", ""B2B High Tech"", ""Consumer Packaged Goods"", ""Education"", ""Financial Services / Insurance"", ""Government / Public Sector"", ""Manufacturing & Distribution"", ""Media, Entertainment & Telecom"", ""Other (HR / IT / Legal / etc.)"", ""Retail"", ""Travel & Hospitality""]"
media.monks,Media.Monks,Platinum,"Media.Monks is a digital-first marketing and advertising services company that connects content, data&digital media and technology services across one global team built from the bottom up","[""Automotive"", ""B2B High Tech"", ""Consumer Packaged Goods"", ""Education"", ""Financial Services / Insurance"", ""Government / Public Sector"", ""Healthcare & Life Sciences"", ""Manufacturing & Distribution"", ""Media, Entertainment & Telecom"", ""Other (HR / IT / Legal / etc.)"", ""Retail"", ""Travel & Hospitality""]"
publicis+groupe,Publicis Groupe,Platinum,Publicis Groupe provides full lifecycle digital and traditional marketing services to premier brands and organizations throughout the world.,"[""Education"", ""Financial Services / Insurance"", ""Healthcare & Life Sciences"", ""Manufacturing & Distribution"", ""Media, Entertainment & Telecom"", ""Retail""]"
razorfish%2C+llc,"Razorfish, LLC",Platinum,"Razorfish is a full-service agency with digital and technology at the core. We create experiences that build businesses, combining the best thought leadership of the consulting world with the leading capabilities of the marketing services industry.","[""Other (HR / IT / Legal / etc.)""]"
axeno+consulting,Axeno Consulting,Gold,Axeno is a customer experience studio specializing in Adobe Experience Cloud powered with great design capabilities.,"[""Automotive"", ""B2B High Tech"", ""Consumer Packaged Goods"", ""Financial Services / Insurance"", ""Government / Public Sector"", ""Manufacturing & Distribution"", ""Retail""]"
leappoint,LeapPoint,Gold,"Helping companies connect work, technology, and talent to drive successful outcomes.","[""Automotive"", ""B2B High Tech"", ""Consumer Packaged Goods"", ""Education"", ""Financial Services / Insurance"", ""Government / Public Sector"", ""Manufacturing & Distribution"", ""Media, Entertainment & Telecom"", ""Non-Profit"", ""Other (HR / IT / Legal / etc.)"", ""Retail"", ""Travel & Hospitality""]"
r2integrated,R2Integrated,Gold,"R2integrated is a digital experience agency focused on accelerating results for our clients through the integration of data, insights, strategic design, and Adobe technology.  Specializations include AEM, Analytics, and Media.","[""Automotive"", ""B2B High Tech"", ""Consumer Packaged Goods"", ""Education"", ""Financial Services / Insurance"", ""Healthcare & Life Sciences"", ""Manufacturing & Distribution"", ""Travel & Hospitality""]"
seidor+opentrends,Seidor Opentrends,Gold,"On the market since 1982, Seidor is a group of companies with 100% Spanish capital, dedicated to providing comprehensive solutions to changing business requirements in the field of information technology.","[""Automotive"", ""B2B High Tech"", ""Consumer Packaged Goods"", ""Education"", ""Financial Services / Insurance"", ""Government / Public Sector"", ""Manufacturing & Distribution"", ""Media, Entertainment & Telecom"", ""Other (HR / IT / Legal / etc.)"", ""Retail"", ""Travel & Hospitality""]"
shift+paradigm,Shift Paradigm,Gold,Shift Paradigm is a marketing and revenue operations consultancy that leads meaningful shifts to drive meaningful results.,"[""Automotive"", ""B2B High Tech"", ""Consumer Packaged Goods"", ""Education"", ""Financial Services / Insurance"", ""Manufacturing & Distribution"", ""Media, Entertainment & Telecom"", ""Other (HR / IT / Legal / etc.)"", ""Retail"", ""Travel & Hospitality""]"
