id,name,level,summary,Industries_Served
abeam+consulting,ABeam Consulting,Bronze,"From Japan, from Asia, a global consulting firm supporting enterprise transformation for a digital age.","[""Automotive"", ""B2B High Tech"", ""Consumer Packaged Goods"", ""Education"", ""Financial Services / Insurance"", ""Government / Public Sector"", ""Manufacturing & Distribution"", ""Media, Entertainment & Telecom"", ""Non-Profit"", ""Other (HR / IT / Legal / etc.)"", ""Retail"", ""Travel & Hospitality""]"
ansira+partners%2C+llc,"Ansira Partners, LLC",Bronze,"Ansira is a marketing technology and services firm that helps brands orchestrate, personalize and contextualize customer engagements to drive exceptional business results and create unique industry-recognized solutions for their clients.","[""Automotive"", ""B2B High Tech"", ""Consumer Packaged Goods"", ""Education"", ""Financial Services / Insurance"", ""Manufacturing & Distribution"", ""Media, Entertainment & Telecom"", ""Non-Profit"", ""Other (HR / IT / Legal / etc.)"", ""Retail"", ""Travel & Hospitality""]"
argondigital,ArgonDigital,Bronze,ArgonDigital is a results-oriented ecommerce agency that combines data-driven strategy and user-centric design to build amazing ecommerce experiences.,"[""B2B High Tech"", ""Education"", ""Financial Services / Insurance"", ""Manufacturing & Distribution"", ""Media, Entertainment & Telecom"", ""Other (HR / IT / Legal / etc.)"", ""Retail""]"
beyondsoft+consulting+inc.,Beyondsoft Consulting Inc.,Bronze,"Beyondsoft provides a broad range of high-quality IT services, including cloud, big data and analytics, business process outsourcing, custom software engineering, test automation, digital enablement, and other digital transformation solutions.","[""Automotive"", ""B2B High Tech"", ""Consumer Packaged Goods"", ""Education"", ""Financial Services / Insurance"", ""Government / Public Sector"", ""Manufacturing & Distribution"", ""Media, Entertainment & Telecom"", ""Retail"", ""Travel & Hospitality""]"
brandwidth+marketing+ltd,Brandwidth Marketing Ltd,Bronze,"Disruptive thinking and digital innovation, backed by strong execution","[""Automotive"", ""B2B High Tech"", ""Manufacturing & Distribution"", ""Media, Entertainment & Telecom"", ""Retail"", ""Travel & Hospitality""]"
capo+commerce%2C+llc.,"Capo Commerce, LLC.",Bronze,Capo Commerce exists to solve e-commerce at scale for mid-sized brands that deserve holistic expertise. We help you realize better investments to grow revenue and increase lifetime economic value.,"[""Automotive"", ""B2B High Tech"", ""Consumer Packaged Goods"", ""Manufacturing & Distribution"", ""Retail""]"
carahsoft+technology+corp.,Carahsoft Technology Corp.,Bronze,"Carahsoft has provided Adobe solutions to government agencies for more than 15 years, transforming how agencies securely create, manage, deliver and optimize personalized digital experiences across platforms with FedRAMP-authorized services.","[""Government / Public Sector""]"
dxc+technology,DXC Technology,Bronze,"DXC has delivered mission critical IT services for over 60 years, with 130K people in 70+ countries","[""Automotive"", ""B2B High Tech"", ""Consumer Packaged Goods"", ""Education"", ""Financial Services / Insurance"", ""Government / Public Sector"", ""Manufacturing & Distribution"", ""Media, Entertainment & Telecom"", ""Non-Profit"", ""Other (HR / IT / Legal / etc.)"", ""Retail"", ""Travel & Hospitality""]"
ebizon+digital,Ebizon Digital,Bronze,EbizON a leading e-commerce and digital activation agency working to provide world class web solutions at the tip of your fingers!,"[""B2B High Tech"", ""Media, Entertainment & Telecom"", ""Other (HR / IT / Legal / etc.)""]"
elevate+digital,Elevate Digital,Bronze,Elevate Digital: Creating Adobe Solutions That Connect and Accelerate Measurable Customer Experiences,"[""B2B High Tech"", ""Consumer Packaged Goods"", ""Education"", ""Financial Services / Insurance"", ""Manufacturing & Distribution"", ""Media, Entertainment & Telecom"", ""Travel & Hospitality""]"
envolvemedia+llc,Envolvemedia LLC,Bronze,Envolvemedia is a collaboration and elearning consulting company that maximizes your Return on Collaboration. We believe that for organizations to succeed in the next decade they must create a collaboration-aware enterprise that leverages a new work parad,"[""Automotive"", ""B2B High Tech"", ""Consumer Packaged Goods"", ""Education"", ""Financial Services / Insurance"", ""Government / Public Sector"", ""Manufacturing & Distribution"", ""Media, Entertainment & Telecom"", ""Non-Profit"", ""Other (HR / IT / Legal / etc.)"", ""Retail"", ""Travel & Hospitality""]"
graphically+speaking,Graphically Speaking,Bronze,"Graphically Speaking's team of web specialists has a proven track record of providing comprehensive web development services for over 3,000 website projects. We are dedicated to providing each client with the best possible return on their web investment.","[""Automotive"", ""B2B High Tech"", ""Consumer Packaged Goods"", ""Education"", ""Financial Services / Insurance"", ""Government / Public Sector"", ""Manufacturing & Distribution"", ""Media, Entertainment & Telecom"", ""Non-Profit"", ""Other (HR / IT / Legal / etc.)"", ""Retail"", ""Travel & Hospitality""]"
hexaware+technologies+ltd,Hexaware Technologies Ltd,Bronze,Hexaware Technologies,"[""Automotive"", ""B2B High Tech"", ""Consumer Packaged Goods"", ""Education"", ""Financial Services / Insurance"", ""Government / Public Sector"", ""Healthcare & Life Sciences"", ""Manufacturing & Distribution"", ""Media, Entertainment & Telecom"", ""Other (HR / IT / Legal / etc.)"", ""Retail"", ""Travel & Hospitality""]"
impelsys+inc.,Impelsys Inc.,Bronze,"Impelsys is a leading provider of technology solutions and services for content publishers, learning providers and enterprises – managing content and learning delivery on its flagship platform, the World’s Most Comprehensive Read-to-Learn Solution.","[""Education"", ""Financial Services / Insurance"", ""Government / Public Sector"", ""Healthcare & Life Sciences""]"
kin+and+carta,Kin and Carta,Bronze,"Our developers have been working with Adobe for many years on some of the world’s largest projects. This has enabled us to provide our clients with the advantage of a unified marketing platform for delivering content across web, mobile and apps. Kin+Carta","[""Consumer Packaged Goods"", ""Financial Services / Insurance"", ""Manufacturing & Distribution"", ""Retail""]"
mw2+consulting,MW2 Consulting,Bronze,"Magento optimization and development are the core of our e-commerce services. Our teams have industry knowledge, e-commerce best-practices and Magento best-practices to ensure you always have a best-in-class system.","[""Automotive"", ""B2B High Tech"", ""Consumer Packaged Goods"", ""Healthcare & Life Sciences"", ""Manufacturing & Distribution"", ""Media, Entertainment & Telecom"", ""Retail""]"
pixafy,Pixafy,Bronze,eCommerce + ERP: The  erpCommerce™ Agency.,"[""Automotive"", ""B2B High Tech"", ""Consumer Packaged Goods"", ""Manufacturing & Distribution"", ""Media, Entertainment & Telecom"", ""Retail""]"
plus+company,Plus Company,Bronze,Plus Company is a unique partnership of forward-thinking agencies.  We unabashedly believe that anything is possible.,"[""Automotive"", ""B2B High Tech"", ""Consumer Packaged Goods"", ""Education"", ""Financial Services / Insurance"", ""Government / Public Sector"", ""Manufacturing & Distribution"", ""Media, Entertainment & Telecom"", ""Non-Profit"", ""Retail"", ""Travel & Hospitality""]"
protiviti,Protiviti,Bronze,"Protiviti Digital is an innovative solution to deliver human centric experiences from Protiviti, a global consulting firm","[""B2B High Tech"", ""Consumer Packaged Goods"", ""Financial Services / Insurance"", ""Government / Public Sector"", ""Manufacturing & Distribution"", ""Media, Entertainment & Telecom"", ""Retail"", ""Travel & Hospitality""]"
staylime,Staylime,Bronze,"Staylime is a Magento design & development company that delivers ecommerce solutions to companies of all sizes, providing end users with engaging omnichannel shopping experience.","[""Automotive"", ""B2B High Tech"", ""Consumer Packaged Goods"", ""Education"", ""Financial Services / Insurance"", ""Government / Public Sector"", ""Healthcare & Life Sciences"", ""Manufacturing & Distribution"", ""Media, Entertainment & Telecom"", ""Non-Profit"", ""Other (HR / IT / Legal / etc.)"", ""Retail"", ""Travel & Hospitality""]"
sutrix+group,Sutrix Group,Bronze,"With over 20 years of delivering compelling digital experiences, Sutrix Group offers onsite Adobe Experience Cloud (AEC) consultancy and hybrid AEC development & integration services globally.","[""Automotive"", ""B2B High Tech"", ""Financial Services / Insurance"", ""Manufacturing & Distribution"", ""Media, Entertainment & Telecom"", ""Retail""]"
tmg,TMG,Bronze,TMG is a full-service commerce consultancy focused on customer experiences and digital transformation.,"[""B2B High Tech"", ""Consumer Packaged Goods"", ""Healthcare & Life Sciences"", ""Manufacturing & Distribution"", ""Retail""]"
to+the+new+pte+ltd,TO THE NEW Pte Ltd,Bronze,Providing a great digital experience leveraging the power of tech & innovation,"[""Automotive"", ""B2B High Tech"", ""Education"", ""Financial Services / Insurance"", ""Government / Public Sector"", ""Media, Entertainment & Telecom"", ""Non-Profit"", ""Other (HR / IT / Legal / etc.)"", ""Retail"", ""Travel & Hospitality""]"
techouts+inc.,Techouts Inc.,Bronze,"Techouts has expertise in implementing large CX Technologies like AEM, Analytics, Personalizing engine and eCommerce. And one of the handful of partners with expertise in integrating SAP Hybris+AEM, and Magento+AEM.","[""Automotive"", ""B2B High Tech"", ""Education"", ""Financial Services / Insurance"", ""Manufacturing & Distribution"", ""Media, Entertainment & Telecom"", ""Other (HR / IT / Legal / etc.)"", ""Retail"", ""Travel & Hospitality""]"
thought+leader+systems,Thought Leader Systems,Bronze,"Thought Leader Systems is a consulting, agency and training company providing the right software, strategy and campaigns for market success and thought leadership","[""Automotive"", ""B2B High Tech"", ""Financial Services / Insurance"", ""Manufacturing & Distribution"", ""Media, Entertainment & Telecom"", ""Other (HR / IT / Legal / etc.)"", ""Retail""]"
vation+digital+private+limited,Vation Digital Private Limited,Bronze,"Vation is a digital experience agency that aims to revolutionize the way businesses interact with their customers and employees by crafting experiences that resonate, inspire, and foster lasting loyalty.","[""Automotive"", ""B2B High Tech"", ""Consumer Packaged Goods"", ""Education"", ""Financial Services / Insurance"", ""Manufacturing & Distribution"", ""Media, Entertainment & Telecom"", ""Other (HR / IT / Legal / etc.)"", ""Retail"", ""Travel & Hospitality""]"
web+force+5,Web Force 5,Bronze,"More than you'd imagine, for less than you'd expect.","[""Automotive"", ""Consumer Packaged Goods"", ""Education"", ""Manufacturing & Distribution"", ""Non-Profit"", ""Retail"", ""Travel & Hospitality""]"
webloo,Webloo,Bronze,"Delivering consistent and groundbreaking creative solutions takes a village. That’s why at Webloo we’re backed by some of the world’s praiseworthy designers, engineers, and marketing pros.","[""Automotive"", ""B2B High Tech"", ""Consumer Packaged Goods"", ""Financial Services / Insurance"", ""Media, Entertainment & Telecom"", ""Retail"", ""Travel & Hospitality""]"
conexio,conexio,Bronze,Conexio is a global Customer Experience Management agency helping leading brands to create meaningful connections with their customers.,"[""Automotive"", ""B2B High Tech"", ""Consumer Packaged Goods"", ""Education"", ""Financial Services / Insurance"", ""Media, Entertainment & Telecom"", ""Non-Profit"", ""Other (HR / IT / Legal / etc.)"", ""Retail"", ""Travel & Hospitality""]"
